,Job Description,Job Title
669,iphone developer excel simform excited work fast growing technology company culture opportunities looking someone take advantage opportunity personal development increased responsibility fast growing company offers ideally confident abilities positive personable always looking new creative ways get things done serve customers better looking mobile developer bring best apps ios devices primary focus develop maintain ios apps integration back end services host expertise shall contribute intuitive design aesthetics best user experience app responsibilities design development professional business applications ios platform leadership help continuously discover evaluate implement new technologies improve development efficiency collaborate multi functional teams define design ship new features dynamic work environment work external data sources apis unit test code robustness including edge cases usability general reliability work fixing bugs improving application responsiveness quality performance leadership help continuously discover evaluate implement new technologies improve development efficiency requirement proficient objective swift experience macos app development watchos app development plus experienced ios frameworks viz core data core animation core graphics core text deep understanding apple design principles interface guidelines familiar working restful apis third party libraries api cloud message apis push notifications knowledgeable performance tuning threading offline storage understand code versioning tools viz git mercurial knowledge low level based libraries useful experienced continuous integration plus,iOS Developer
6,senior full stack developer cwt looking senior full stack developer proven back end skill well strong front end skill role use cutting edge technology help develop next generation business travel solution million user worldwide participate lead architecture review technology standard definition lead effort find implement support new technology framework standard experiment implement propose new process technology develop back end system designed scale analyze business software requirement develop back end software test learn new technology broaden tech stack provide tier production support handle live production issue participate develop agile software development process qualification degree computer science engineering relevant field equivalent industry experience minimum year experience developing following nodejs java experience nosql solution mongodb elasticsearch redis experience react angular knowledge single page application spa development advantage experience javascript html responsive cross browser advantage experienced developing rich large scale web application advantage experience developing robust http apis back end service passion technology building product team player excellent interpersonal skill self motivated independent learner eligible candidate must valid passport able travel israel week training shortly hired primary location chicago work home employment type standard job family information technology scope global travel yes time shift day job organization t_hotel product experience level year job posting may equal opportunity employer affirmative action employer organization discriminate employment practice due applicant race color religion sex national origin veteran status disability status sexual orientation gender identity federal state local protected class,Full Stack Developer
1986,job summary selected candidates assigned varied roles responsibilities depending need projects allotted certain team working guidance seniors responsibilities duties good communication skills able provide work estimates support monitoring project readiness shall proactive learning minimal guidance key skills back end technologies python django django rest framework git version control system basics knowledge aws required experience qualifications years experience candidate benefits technical skill training grooming given regular basis mentoring facility given rewards recognition job types full time internship fresher salary per month schedule day shift monday friday experience total work year preferred work remotely,Django Developer
1924,build optimize back end mobile web applications strong knowledge building rest ful api knowledge git cloud development experience using aws deployment process familiarity database technology mongodb mysql postgresql design develop new micro services integrate existing rest web services years professional experience node express deliver high quality innovative flexible cost optimized scalable technical solutions meet business requirements develop construct test maintain architecture databases large scale data processing preference prefer candidates kerala benefits high technology exposure good salary per industry standards flexible work environment work time work home facility application deadline expected start date job type full time salary per month benefits flexible schedule work home schedule day shift flexible shift experience programming year preferred work year preferred total work year preferred education secondary pass preferred work remotely yes_occasionally,Backend Developer
490,looking developer responsible managing interchange data server users primary focus development server side logic definition maintenance central database experience,Node js developer
2211,key responsibilities design code analyse test systems joyride ios app end end feature development mobile frontend writing high performance modular front end code work closely design product teams implement polish design mocks precise detailed level skills required years experience mobile frontend ios platform consumer business good fundamentals code design object oriented programming expertise writing high performant modular front end code extremely detail oriented knack design details strong empathy end user experience self driven self motivated comfortable deadlines fast iteration cycles experience unit testing excellent interpersonal communication skills bachelors masters engineering top tier institutes preferably related computer science knowledge android backend plus website http www kiwiup com job location bangalore years experience yrs yrs annual ctc venue floor zedone construction building main next sapna book house khb colony block koramangala bengaluru karnataka,Backend Developer
1664,looking node developer result oriented believes leading front always willing extra mile strong knowledge building scalable solutions node eager learn new technologies education qualification tech graduate experience years salary per industry standards employment type full time job location noida uttar pradesh skills responsibilities minimum year experience planning implementing projects mean platform experience web development technologies like angularjs nodejs git npm grunt must laravel zend framework symfony codeignitor cms experience added advantage development experience rest soap web services familiarity newer specifications ecmascript experience relational databases mysql mssql key value document based databases dynamodb mongodb experience using developing graphql apis experience designing building micro services cloud based platforms using aws lambda decent communication skills,Node js developer
34,staff machine learning scientist hyderabad bangalore remote compass building first modern end end real estate platform integrating agents buyers sellers technology compass one achieved blend natural intelligence hundreds thousands enterprising real estate agents bring market artificial intelligence cloud mobile technologies enable one fastest growing technology companies generation industry larger opportunity obligation build world class engineering team operating platform transform real estate industry tripled size product engineering team searching creative inspiring colleagues levels engineering organization join continue expand looking staff machine learning scientists proven track record solving machine learning problems utilizing strong machine learning data science skills opportunity make huge impact fast paced environment great company role compass looking staff machine learning scientist help build future real estate compass building end end real estate technology platform empowers agents consumers team responsible using machine learning build features empower agents intelligent tools add intelligence consumer facing products looking someone proven track record deploying supporting machine learning models scale customer facing features responsibilities using machine learning skills explore deeply understand compass data architect machine learning products solve business needs perform feature engineering modeling tasks top data power customer facing features collaborate machine learning engineers produce features production ready state support machine learning features throughout product life cycle drive design implementation house machine learning infrastructure look experience working machine learning product oriented environment ability collaborate scientists product management work engineering focused iterative team build establish product requirements knowledge machine learning frameworks tooling example spark pytorch scikit learn etc comfortable building prototypes scratch experience working microservices based architecture experience aws development phd computer science machine learning equivalent phd preferred years experience preferred compass mission help everyone find place world means continually celebrate diverse community different individuals cultivate equal opportunity employer stay true mission ensuring place anyone place check engineering blog,Machine Learning
1651,min years experience working php web development software design experience working wordpress php code level including understanding existing built wordpress functions custom post types coding standards plugins widgets custom theme integration best practices experience least one php framework laravel yii zend framework symfony etc proficient understanding source control code versioning tools git bitbucket deep expertise hands experience web applications programming languages php javascript jquery api rest soap etc strong knowledge user authentication authorization multiple systems environments excellent analytical conceptual multitasking problem solving abilities,Wordpress Developer
1001,skill sets proven working experience software development working experience ios development published one ios apps app store deep familiarity objective cocoa touch experience working ios frameworks core data core animation core graphics core text experience third party libraries apis working knowledge general mobile landscape architectures trends emerging technologies solid understanding full mobile development life cycle responsibilities design build advanced applications ios platform collaborate cross functional teams define design ship new features unit test code robustness including edge cases usability general reliability work bug fixing improving application performance discover evaluate implement new technologies maximize development efficiency job type full time pay per year schedule day shift supplemental pay quarterly bonus experience work year preferred total work year preferred ios year preferred education bachelor preferred programming languages needed objective preferred,iOS Developer
578,senior full stack engineer practice engineering report director engineering flsa exempt summary working together project manager designer engineer full stack engineer responsible developing maintain awesome application client utilizing full chaione tech stack essential duty responsibility independently produce code mobile documented communicated trained create production ready code mobile follow defined project architecture chaione best practice leverage latest full stack best practice code testable readable well documented deployed cloud environment work within highly effective development team complete implementation per architecture time within project parameter stakeholder satisfaction create rapport communicate development decision senior lead educate peer junior developer best practice aid producing confirming estimate accurate consistent achievable lead delivery high quality product competency bachelor degree computer science related field year development experience animation deployment docker ember cli aws heroku azure analytics flurry amazon mobile analytics google analytics apple app analytics sentry continuous integration push notification configuring project receive push notification provisioning experience push service provider urban airship azure amazon localization internationalization json api ember ember cli ember data handlebar react flux redux npm yarn chaione tool stack github jira postman good written verbal communication skill anjular plus predix certification plus take chaionenaut chaione tight knit bunch creative curious passionate people reason know love work flexible social work environment solve challenging meaningful problem worth solving explore cutting edge technology harness power transform way business operate please note job description designed cover contain comprehensive listing activity duty responsibility required employee job duty responsibility activity may change time without notice,Full Stack Developer
2348,northshore resource contract hire opportunity web java full stack developer bloomington overview looking senior java developer year development experience work client bloomington location web mobile team strives provide exceptional digital experience customer take pride ownership product build seek creative passionate engineering minded software engineer looking environment core set value anchored trust autonomy relentless focus user experience client team culture focus strong communication tight feedback loop continuous process among agile team productive relationship business product development team help deliver great software promote cross functional behavior among team member expect ability design write clean maintainable code using language framework use java javascript spring framework spring mvc spring boot react angular bootstrap value culture continuous learning improvement experimentation implement modern engineering practice ensure product quality test driven development test automation practice ability work effectively collaborative agile environment ability design build cloud platform including leveraging micro service container collaborate closely engineer team discipline provide mentorship technical leadership project team peer build resilient scalable system readily evolve future constantly striving deliver value customer,Full Stack Developer
1117,flutter developer create multi platform apps ios android using google flutter development framework primary focus creating new experiences additionally work innovative new app projects job type full time salary per month schedule morning shift experience total work years preferred work remotely yes,Flutter Developer
1496,looking incredible ios developer bring mobile development next level primary responsibilities least years web mobile development experience least year full time iphone programming experience using objective least non trivial completed iphone app submitted market experience commerce web sites desirable portfolio apps developed must provided required qualifications minimum years relevant experience,iOS Developer
675,minimum years experience software development system administration operations experience least one programming language java angular ios android experience linux unix administration knowledge best practices operations always always available service knowledge experience continuous integration tools knowledge experience least one source control tool git svn knowledge experience configuration management tools ansible preferably knowledge experience application monitoring logging alerting knowledge experience testing unit smoke integration scripting experience bash experience virtualized environments vmware docker,DevOps Engineer
162,associate staff engineer net core web kubernetes years experience nagarro nagarro helps clients transform adapt build new ways future entrepreneurial agile caring mindset excel digital product engineering deliver promise thinking breakthroughs today experts across countries forming nation nagarrians ready help customers succeed nagarro look forward work culture dynamic non hierarchical given opportunities add value challenging complex assignments collaborating world class technologists versatile environment helps foster fresh perspectives enables deliver high quality code ample opportunities provided skill upgradation accelerate professional personal development makes good fit role relevant expertise asp net core mvc web services kubernetes docker sql nosql databases strong knowledge javascript javascript onwards html css ooa ood concepts experience relational database sql server mysql oracle cloud platform amazon azure google cloud experience testing frameworks web mstest nunit jasmine karma mocha repositories git svn tfs passionate writing world class code high level commitment client satisfaction agility collaborate others build positive working relationships possess strong work ethic strong written verbal communication skills responsibilities analyzing project requirements ability convert said requirements technical documents design code implementing design methodologies tool sets writing well designed defect free code scales well follows best practices guidelines executing development software strong focus security performance robustness conducting deep level analysis identify root cause systematically resolve issues following defined software configuration management best practices reviewing code identify issues well deviations best practices addressing issues promptly responding positively setbacks challenges mindset continuous improvement,Software Engineer
38,hunt wordpress developer years experience capable collaborating web designers match visual designs skills qualifications prior experience working wordpress plugin customization wordpress woo commerce magento php open source framework must expertise wordpress theme integration able work per client instruction design page layouts knowledge php cms like magento joomla cakephp would added advantage good understanding cross platform cross browser issues web performance optimization basic knowledge search engine optimization process experience reactjs plus roles responsibilities write testable well designed efficient code using best software development practices reusable php modules match latest international web protocols standards technologies create website layouts user interface following standard html css wordpress practices integrate data various back end services databases responsible maintaining expanding scaling various websites stay plugged emerging technologies industry trends,Wordpress Developer
252,senior software development engineer test sdet java javascript python trimble exciting entrepreneurial company history exceptional growth coupled disciplined strategic focus best gps core grown beyond technology embrace sophisticated positioning technologies changing way world works solutions used countries incredibly diverse lines business employees represent diversity found countries working closely colleagues around world due geographic product customer reach plenty room trimble exceptional people grow come position innovative industry leader position success measures success review requirements specifications user documentation help files project documentation assure quality products tests developed work development team capture reuse automated test suites release engineering team build deploy automation build release production servers ensure proper version control configuration management test objects developed test environments used provide project test status estimates metrics derived testing technical knowledge automation tools framework ability achieve targets trace test results regularly scheduled test updates results back specific quality risks promptly skills experience required least years experience white box testing years experience leading testing effort hands experience aws cloud environments hands experience structured query language sql oracle mysql database hands experience linux commands scripting hands experience automation testing tools good understanding role automated testing within software development lifecycle hands experience programming must worked agile scrum extreme programming environments participant estimation planning responsible ensuring performance reliability scalability systems sufficiently testing systems responsible code coverage metrics automation coverage metrics must exp https rest rfcs understanding must exp oauth oidc rfc spec understanding must exp session management must exp web security testing must exp saml preferable exp datastructures algorithms must exp aws lambda must requirements strong analytical skills good communication skills engineering linkedin post trimble inc proud equal opportunity affirmative action employer considers qualified applicants employment without regard race gender age color religion national origin marital status disability sexual orientation status covered veteran accordance applicable federal state local laws protected factor eoe,JavaScript Developer
1137,javascript developer responsible programming development applications software using popular programming language java order attract javascript developer best matches needs important write clear precise java developer job description job types full time fresher walk salary per month schedule day shift experience work year preferred total work year preferred javascript year preferred education secondary pass preferred work remotely speak employer,JavaScript Developer
1450,mandatory skill sql admin job description key skill required job sql admin mandatory senior administrator able handle first point escalation technical process issue provide technical subject matter expertise wherever required ensure proper communication quick resolution crisis manager plan schedule change coordinating different stakeholder perform rca major incident related tower follow quality security process defined engagement perform trend analysis identify top incident work respective teams individual minimize incident hardware troubleshooting vendor coordination prepare weekly monthly status report participate business meeting various stake holder need basis take corrective action based customer satisfaction survey work service improvement program effort estimation reviews need basis new project training new team member able work knowledge acquisition update related document minimum work experience year role responsibility minimum experience required year mandatory skill sql admin database performance tuning infra trouble shooting operation database high availability infra storage administration database admin database backup recovery desirable skill language skill english language,Database Administrator
1867,required python django developer jaipur location details follows job profile python django developer company type commerce online business required experience min years required skills expert python good knowledge python web framework django familiarity orm object relational mapper libraries able integrate multiple data sources databases one system good understanding server side templating languages basic understanding front end technologies javascript html css knowledge user authentication authorization multiple systems servers environments location jaipur job type full time pay per year schedule day shift evening shift work remotely,Django Developer
628,aspiring node developer looking opportunity work great team advance skills career analytical problem solver strong node knowledge passion team work innovation perfect job looking node developer join fun energetic team duties responsibilities work part team developing applications services using agile development methods contribute team organizational improvements process infrastructure build customer facing back end services payment processing administration management code teste operate node based services effectively use tools ingenuity identify fix defects become problem requirements qualifications depth knowledge node hands experience html css electronjs ajax development experience designing object oriented javascript svg applicable knowledge web libraries frameworks angularjs polymer closure familiarity whole web stack including protocols web server optimization techniques strong analytical skills problem solving aptitude attention details job type full time salary per year experience software development year preferred work year preferred total work year preferred java year preferred education bachelor required,Node js developer
