,Job Description,Job Title
673,urgent opening flutter developer develop mobile apps development strong knowledge flutter hybrid react native google map roles responsibility developing mobile applications flutter create multi platform apps ios android using flutter development framework flutter sdk dart programming language skills required flutter dart firebase ios android development hybrid restful apis flutter google cloud react native google maps experience must years experience preference immediate joiners job types full time work home job type full time salary per year schedule day shift work remotely temporarily due covid,Flutter Developer
814,johnson johnson technology recruiting machine learning engineer consumer health experience offering position mumbai india may need travel global business development centers europe time based active product development billion sales jnj world comprehensive broadly based health care company products services span consumer pharmaceutical medical devices markets employees operating operating companies worldwide products touch lives billion people throughout world every single day steadfast pursuit help people live healthier happier lives innovation heart organization embedded fuels discovery development new products extends collaborations education community efforts bring new solutions need seeking someone passion bridging well designed technology solutions needs customer daily health journey play analyst role crafting machine learning data driven solutions lead ground breaking change accelerate business value team work closely key technology business partners apply human centered design techniques empathize users help design solutions delight collaborate business execute experiments users validate refine problems solutions analyst coordinate participate core team developers software engineers technical software architects build test train models standard pipeline responsible advising team develop incubate solution minimum viable product successful continue scale launch continually develop solution drive higher levels engagement participation employ champion agile best practices accelerate velocity deliver solutions seek workers equivalent technical field deep technology development experience expect experience analysis strategic assessment support unique independent thought creativity combined pragmatic analytical difficulty cultivate significant insights inspire advise technical development looking dynamic creative technology role helping people live healthy vibrant lives part johnson johnson consumer health may career opportunity help make happen join key responsibilities customer centric integrated team develop keen understanding needs perceptions partner closely solutions teams cloud engineers build innovative product solutions product development engineering regulatory medical clinical affairs product safety laboratories groups world wide basis apply knowledge improve key business outcomes love data find opportunities drive continual improvement demonstrating new existing metrics also work gxp compliant environment ensure information assets appropriately identified valued protected complying making sure local worldwide security policies global team partner extended team internal external partners across multiple time zones provide outstanding custom development technology solutions regularly provide customer facing communications demos related products budgets value delivery senior leaders technology organizations qualifications education minimum bachelor degree computer science engineering related required minimum years related business experience required experience skills excellent written oral communication skills interpersonal skills strong negotiating skills ability motivate collaborative environment exceptional service orientation requirements good data structure algorithms analyze extensive scale data train models evaluate right metrics proven experience lead similar roles worked python cloud aws azure platforms pipeline integrate components fully functional software system provide hands models designs prototypes implementations incorporating intelligent software engineering tools monitoring according industry best practices hands programming chip optimal project work proficiency software engineering tools ability document requirements specifications ability craft context around key business features behaviors present ideas business friendly user friendly language domestic international travel required position experience skills strong development background proven record delivering results proven technical leadership influencing skills interdependent partnering skills well critical thinking skills required experience defining cloud based api gateway solution architecture also responsible leading technical direction configuration project development ongoing operations application deep understanding cloud development practices previous hands coding experience required agile development experience sdlc methodology risk management including security required ability synthesize leadership partner inputs decisions lead medium high level complexity comfortable operating amongst senior partners required ability estimate required effort project objectives prioritize work items appropriately experience working devops team delivering continuous integration development preferred johnson johnson affirmative action equal opportunity employer qualified applicants receive consideration employment without regard race color religion sex sexual orientation gender identity age national origin protected veteran status discriminated basis disability ensure individuals disabilities provided reasonable accommodation participate job application interview process perform essential job functions receive benefits privileges employment please contact request accommodation primary location india maharashtra greater mumbai organization johnson johnson private limited job function info technology requisition,Machine Learning
1116,job python developer professionally managed company based central delhi india services include website designing web development commerce website word press website logo banner web hosting seo search engine optimization smo social media optimization pay per click ppc digital marketing learning etc job description looking python web developer responsible managing interchange data server users primary focus development server side logic ensuring high performance responsiveness requests front end also responsible integrating front end elements built workers application therefore basic understanding front end technologies necessary well duties responsibilities daily duties python developers vary based websites applications programs used hiring company however main responsibilities across businesses industries maintain existing programs python developers maintain existing programs apps used company troubleshooting spot potential problems ensuring continue function smoothly write new programs python developers write new programs applications streamline business functions increase productivity company wide reprogram databases python developers reprogram existing databases increase functionality data capacity manage online pages python developers streamline web portals writing new programs addition designing maintaining websites manage servers python developers manage maintain company servers keep functioning efficiently across network design marketing programs python developers design programs marketing campaigns including promotional emails web applications create online tools python developers create digital tools applications monitor online traffic maximize customer experience web pages skills qualifications expert python knowledge least one python web framework django flask etc familiarity orm object relational mapper libraries able integrate multiple data sources databases one system understanding threading limitations python multi process architecture good understanding server side templating languages basic understanding front end technologies javascript html css understanding accessibility security compliance knowledge user authentication authorization multiple systems servers environments understanding fundamental design principles behind scale able application familiarity event driven programming python understanding differences multiple delivery platforms mobile desktop optimizing output match specific platform able create database schema represents support business processes strong unit test debugging skills proficient understanding code versioning tools job type full time salary per month schedule morning shift experience work year preferred total work year preferred python year preferred education bachelor preferred,Django Developer
163,skills nodejs express javascript jquery git roles responsibilities assisting integration technical application components coding testing program modules assisting design maintaining tuning repairing applications providing user support participating execution documentation tests executing conversion plans documenting possible improvements identifying disruptions processes,Node js developer
1758,technical skills html css javascript wordpress react job responsibility determining structure design web pages ensuring user experience determines design choices developing features enhance user experience striking balance functional aesthetic design ensuring web design optimized smartphones building reusable code future use optimizing web pages maximum speed scalability utilizing variety markup languages write web pages maintaining brand consistency throughout design front end developer requirements degree computer science related field understanding key design principles proficiency html css javascript wordpress jquery understanding server side css experience graphic design applications adobe illustrator experience responsive adaptive design understanding seo principles good problem solving skills excellent verbal communication skills application deadline expected start date job type full time salary per month schedule morning shift supplemental pay performance bonus experience html css jquery years required wordpress html years required education bachelor required work remotely yes,Wordpress Developer
928,design build advanced applications android platform kotlin work bug fixing improving application performance continuously discover evaluate implement new technologies maximize development efficiency job types full time walk salary per month experience android development year preferred total work years required kotlin year preferred education bachelor preferred,iOS Developer
2064,looking backend developer good knowledge python django minimum year experience fresher may also apply proper internship experience completed project technology mentioned job type walk salary per month schedule morning shift,Backend Developer
618,experience yrs openings brief position role looking experienced wordpress developer requirements mins years experience creating new sites wordpress excellent experience working sass css php html jquery javascript excellent knowledge customize responsive theme experience creating custom wordpress themes plugins good sense design good woocommerce experience skills wordpress html css php sass css front end woocommerce javascript jquery design wordpress developer,Wordpress Developer
1608,job description accenture accenture leading global professional services company providing broad range services strategy consulting interactive technology operations digital capabilities across services combine unmatched experience specialized capabilities across industries powered world largest network advanced technology intelligent operations centers people serving clients countries accenture brings continuous innovation help clients improve performance create lasting value across enterprises visit www accenture com project role application designer project role description assist defining requirements designing applications meet business process application requirements must skills machine learning good skills technology specialization job requirements key responsibilities analyzing use cases identify opportunities apply appropriate predictions regression classification recommendation work wid stakeholders devs tls design new predictive based solutions assets platform define actionable insights agile env coordinate data preparation data engineer specifying features generate needed perform extensive research tech evaluate new prod arch provide guidance team conducting proof technical experience exp models like regression clustering gradient boosting bayesian methods random forests svm markov models collaborative filtering deep learning including nets lstm cnn model performance evaluation tuning full time design algo exp nlp tech ability dvlp interpret algo models knowledge prog lang like java scala python interpret data analyze patterns results using stat tech creating data dashboards graphs visualizations dvlp report professional attributes excellent analytical tech comm inter personal presentation skills passion research ability learn fast excellent exp interaction handling clients relevant use cases analyze data define features needed select train models assess perf tune model educational qualification grad stat stat tech diploma data science premier institute preferred additional information design dev exp databases like oracle sql databases proficient apis web based tech qualifications years full time education,Machine Learning
70,overview cure start fred hutchinson cancer research center home three nobel laureate interdisciplinary team world renowned scientist seek new innovative way prevent diagnose treat cancer hiv aids life threatening disease fred hutch pioneering work bone marrow transplantation led development immunotherapy harness power immune system treat cancer independent nonprofit research institute based seattle fred hutch house nation first cancer prevention research program well clinical coordinating center woman health initiative international headquarters hiv vaccine trial network career start database administrator iii work closely customer peer troubleshoot complex technical problem ensure smooth operation database server database application dba iii responsible maintaining data integrity protecting data loss responsibility general guidance database administrator iii expected perform range complex assignment project established solution expected provide solution unique complex problem contribute process improvement within database team act resource mentor experienced colleague dba iii depth knowledge database application administration expected subject matter expert one area application support limited tier support customer application tier support customized application tier backup support enterprise application position may perform following responsibility serve technical lead large complicated project provide new improved database service install configure maintain decommission database server database customer customized application includes initial installation upgrade patching migration prem cloud implementation troubleshoot complex issue database platform database customer application design deliver formal informal presentation variety technical topic peer colleague lead hardware software evaluation database server database platform lead technical evaluation customer application cit participate technical evaluation enterprise application contribute effort improve process meet strategic goal within dba team across multi disciplinary group fulfill day day operational task associated database application support design implement script perform etl provide support mission critical application database rotating basis limited database platform database customer application serve backup support enterprise application architect monitor report database application usage availability ensure proper database monitoring alerting response control limit database access compliance data security policy best practice maintain data integrity monitor database server query high performance create technical documentation diagram comprehensive understandable comply departmental process change management problem management incident management duty assigned qualification professional skill ability analyze provide creative innovative solution complex technical problem proven track record coaching mentoring team member practice personal improvement continuous professional technical education training demonstrate excellent customer service relationship building ability interact successfully communicate clearly must exercise high degree discretion judgment dealing customer vendor fred hutch staff promote positive safe work environment minimum qualification bachelor degree preferably computer science information system related field equivalent work experience year experience technical position querying experience sql exposure increasing responsibility strong knowledge sql server administration experience cloud based computing microsoft azure aws solid analytical troubleshooting problem solving skill able work cooperatively establish positive working relationship cross functional team including customer service system storage administrator networking technician reliable self starter work independently member team strong organizational interpersonal communication written verbal presentation skill demonstrated ability understand long term impact choice communicate others commitment diversity committed cultivating workplace diverse perspective experience welcomed respected proud equal opportunity vevraa employer discriminate basis race color religion creed ancestry national origin sex age disability marital veteran status sexual orientation gender identity political ideology membership legally protected class affirmative action employer encourage individual diverse background apply desire priority referral protected veteran due disability need assistance reasonable accommodation application recruiting process please send request employee service center escmail fredhutch org calling,Database Administrator
2057,informatica empowers world progressive companies realize data driven digital transformations changing live data values good act one team think customer first aspire future together conquering impossible data changing unimaginable whats commonmaking lives richer businesses stronger world better unleash potential career informatica gives opportunities benefits come working trusted industry leader joining team able solve real life problems make difference global impact join supportive group globally diverse teammates encourage grow unleash potential description informatica currently looking senior devops engineer experience elastic stack kubernetes join team bangalore india job summary senior devops engineer cloud trust team support centralized elastic stack observability security senior devops engineer responsible supporting centralized elastic stack informatica engineers role senior devops engineer must able work adapt fluid fast paced environment working senior devops engineer must strong technical communication collaboration leadership skills technology youll use jobs elastic stack eck kubernetes gitops java lang python aws azure gcp docker kafka kinesis sqs grafana prometheus jaeger zipkin ansible chef youll build operate large scale elk clusters deployed multiple cloud providers driving initiatives evolve current platform increase efficiency keep line current standards best practices manage onboard users elastic apm open telemetry open tracing rollout gitops manage many elasticsearch clusters ensure zero downtime highly available upgrades maintenance activities perform incident alert troubleshooting problem analysis provide high quality solutions technical issues call support cases issues production environment work geographically dispersed team key essentials experience logging telemetry services specifically elk jaeger zipkin grafana prometheus experience either cloud providers aws azure gcp able code good standard programming language python ruby experience writing infrastructure code using tools terraform cloudformation solid understanding configuration management principles tools chef comfortable supporting operating high availability cloud services provide call support sev incidents production critical development cloud environments understanding principles linux fundamentals networking concepts protocols self motivated strong problem solving troubleshooting skills experience building operating kubernetes clusters success look like enable product teams self service capabilities ensure zero downtime adhering defined slas higher uptime system nice years systems administrations enterprise software development operations years experience managing cloud operation environments scale production years experience full implementation building managing elasticsearch logstash clusters years experience working real time data streaming tools kafka kinesis etc experience working container runtime docker containerd cri experience building dashboards kibana grafana experience instrumenting distributed tracing jaeger zipkin elastic apm experience production level monitoring alerting tools like prometheus grafana experience cloud automated deployment tools chef ansible spinnaker puppet plus prior experience performing participating compliance security audits plus prior experience defining configuring implementing disaster recovery process ability perform data related benchmarking performance analysis tuning,DevOps Engineer
960,experience years skill set node mongodb mysql redis one databases experience creating rest web services frameworks one frameworks nodejs frameworks nest hapi express koa good good experience message queue kafka rabbitmq workflow engines camunda process maker good experience tdd approach good experience socket programming good experience cloud deployments looking back end web developer excellent programming skills join team need person part team create highly scalable web apps ideal candidate experience building real products web able present examples work key responsibilities maintain contribute adhere programming best practices guidelines advanced understanding emerging web technologies design codes superior technical solutions good understanding sql nosql databases good debugging skills good analytical skills good communication skills good knowledge oops concepts good team player know agile methodologies must aware devops concepts hands git equivalent code repository system knowledge design patterns selection process send resume jobs iauro com shortlisted profiles hear soon,Node js developer
125,role backend developer works mumbai gurugram office part technology team help greenlight planet easybuy business unit design develop software improve field force operations key responsibilities role design build applications systems based wireframes product requirements documents design develop logical physical data models meet application identify correct bottlenecks bugs according operational requirements unit test code robustness including edge cases usability general reliability write reusable easy maintain versioned code using dry principles automate business processes using tools like zapier google scripts automation tools integrate existing tools business systems house tools business tools like ticketing softwares communication tools external services coordinate product manager development team business analysts ideal candidate development experience years strong problem solving data structures deep knowledge oops concept programming skills core java knowledge sql mysql similar database management experience web service integration soap rest json xml familiarity restful apis connect android applications back end services experience cloud message apis push notifications firebase preferably understanding code versioning tools git svn experience agile scrum development process tools knowledge spring framework hands experience aws storage redshift instances creation deployment good scripting language like shell script make system automatic experience angular plus knowledge messaging systems rabbitmq container based application deployment docker equivalent willing learn new technologies implement products seek foster team diversity terms culture life experiences especially encourage women sexual gender minorities people disabilities members underrepresented groups apply discriminate basis race color religion sex marital status sexual orientation national origin hiv aids status disability,Backend Developer
157,wanted android ios web developer fresher year experience person knowledge experience backend api development preferred skill set kotlin swift flutter php net javascript html job type full time salary per month schedule day shift education bachelor preferred work remotely speak employer,Flutter Developer
