,Job Description,Job Title
1280,umenit unique opportunity experienced ios developer take leadership role great opportunity join team encourage new ideas kinds skills looking maintain enhance ios applications translate requirements mock ups fully functioning features develop new existing ios applications features provide estimates development cycles partner designers help define implement user interface improvements work team members server side integration bonus points experience apple approval distribution process hoc enterprise distribution sql knowledge willingness learn built approved store app experience working testing passionate open source contribute afraid solve deep technical challenges whole new level huge scale intrinsic curiosity technological innovations always top latest trends desired candidate profile required experience years information send application please contact careers umenit com,iOS Developer
133,hello candidates looking full stack developer take key role team full stack developer must knowledge stages software development kubernetes api server experience optional experience developing web application experience minimum years specialty core java java script php sql tools ide android android studio ios swift eclipse visual studio framework google web toolkit gwt hibernate struts angular svelte ruby rails laravel interested candidates may apply part time hours per week job types full time part time salary per year experience programming years preferred total work years required education bachelor required work remotely,Backend Developer
1626,company startup working internet things domain products space built amazing products transform businesses customers day day lives internship job selected intern day day responsibilities include working python web framework linux design develop modules applications working iot space apply students freshers apply available full time office internship relevant skills interests start internship oct dec available duration months already graduated currently year study hyderabad neighboring cities females willing start restart career may also apply number internships jobs available categories python django web development computer science engineering internet things iot electronics,Django Developer
1438,takes brightest minds technology leader takes imagination create green energy generations come siemens gamesa make real matters join global team designs implements maintains enhances tests supports software develops software reviews relevant requirements standards documentation clarify understand software engineering requirements provides estimates modules development estimates work completes development software test requirements modules development executes software unit integration tests presents technical findings developments adheres software quality process execution module subsystem system test procedures analyzes localization requirements designs adapts products solutions accordingly siemens gamesa renewable energy global organisation recognizes employees represent large variety cultures ethnicities beliefs languages wealth diversity makes siemens gamesa renewable energy innovative creative sensitive committed society diversity makes immensely proud siemens gamesa renewable energy believes right treated dignity respect workplace regardless race nationality ethnicity religion beliefs sex sexual orientation gender circumstances pregnancy parental leave age disability marital status seek promote respect law equality inclusion employees order ensure discrimination reason race gender marital status ideology political opinions nationality religion personal physical social condition siemens gamesa renewable energy offers truly flexible inspiring place work global presence commitment providing working environment every employee develop potential maximize contribution,Backend Developer
2349,job description years relevant development experience node angular react restful services express mongodb javascript git roles responsibilities need successful role hands experience node hands experience angular react hands experience building restful services express koa loopback experience sql nosql databases mongo must good understanding oops concepts good knowledge javascript javascript frameworks experience integrating different party apis google maps facebook etc good knowledge git good typescript gulp webpack azure aws docker competencies excellent verbal written communications willingness learn develop skill set works well within team environment logical thinker good problem solving analytical skills willingness get root problem proactive think approach job note work home position selected candidate work office hyderabad lockdown ends eligibility excellent academic record tech cse job type full time pay per year experience software development year required total work year required education bachelor required,Node js developer
2320,job description description develop test maintain web based applications specified designs standards using python frameworks like django develop implement modern web services using service oriented architecture restful apis soap write execute unit tests perform code reviews implement front end interfaces experiences modern html css jquery angular react test troubleshoot optimize application components maximum speed security stability scalability skills experience years experience python development object oriented programming skills expertise mysql mariadb postgresql knowledge rest api json etc experience version control systems git knowledge preferred strong documentation communication team collaboration skills job types full time fresher walk salary per year benefits food allowance health insurance life insurance schedule monday friday morning shift supplemental pay overtime pay yearly bonus experience work year preferred total work year preferred python year preferred education bachelor preferred work remotely temporarily due covid speak employer,Django Developer
1925,hiring hardware network engineers openings hcl ibm wipro local candidates apply example chennai provinding training placements infrastructure hardware networking roles network engineer hardware engineer remote support server support call ordinator desktop support qualification degree apply without arriers location chennai bangalore coimbatore trichy trivandrum note local candidates apply example chennai futhure details contact team,Network Administrator
552,role software developer backend developer world never stands still new challenges arise every day passion questioning things supplying ideas intelligently driving things forward helping society move towards intelligent future technologies reduce carbon emissions cities hyperintelligent robots able tackle important projects push forward together help shape future innovative integrated technology support customers continuously improving reliability safety efficiency products processes plants help shape future looking dedicated people skills vision build better tomorrow join digital process industries team system engineer help create technology transform entire industries cities even countries change future primarily responsible development delivery parts software component projects based software design development delivery parts product accordance customers requirements organizational quality norms activities performed include requirement analysis design software solutions based requirements architectural design guidelines implementation features bug fixing delivering solutions accordance coding guidelines time high quality derive software requirements software functional specification validate software requirements provide software feasibility analysis software effort estimation identification implementation unit integration tests ensure solution addresses customer requirements quality security requirements product met perform code review creation support relevant documentation requirement design test specification need make real matters need professional years industry experience enterprise application development especially web applications proficient familiarity net framework net core good database skills hands development skills sql server oracle experience developing applications using asp net mvc web api knowledge net core added advantage good experience linq entity framework restful services strong understanding object oriented programming paradigms good understanding basic data structures algorithms must good problem solving skills good understanding various design patterns sdlc experience agile methodologies experience writing unit tests using nunit xunit usage version control tools like tfs git etc got quite lot offer role based bangalore also get visit locations india beyond need journey takes return get chance work teams impacting entire cities countries shape things come siemens collection minds building future one day time countries dedicated equality encourage applications reflect diversity communities work employment decisions siemens based qualifications merit business need bring curiosity creativity help craft tomorrow find siemens careers www siemens com careers organization advanta company siemens technology services private limited experience level experienced professional job type full time,Backend Developer
1387,job title java backend developer location remote position mode employment duration longterm immediate requirement java backend developer required skills must worked cloud technologies springboot microservices job title java backend developer location remote position mode employment duration longterm immediate requirement java backend developer required skills must worked cloud technologies springboot microservices years experience java years experience deploying micro services onto cloud technologies years working integrated team end end development using agile methodologies data service layer solution development experience proficiency java springboot apigee experience developing tools support models entire process data source discovery integration model training model risk management model deployment education bachelors degree computer science information systems related field equivalent work experience anyone interested available drop resumes kathys dextroinc com,Java Developer
54,ios swift developer individual contributor project already running android must knowledge swift realm node rest api fetch exchange data postman sqlite opportunity apply skills expertise design innovative application solves complex problems enhance performance productivity key responsibilities adapt design implement deliver test innovative ios swift applications understanding products technical product perspective communicate leadership product owners technologists users create working software based understanding business technical priorities break complex problems elegant technical solutions intelligently solve problems actively contribute adoption strong software architecture development best practices new technologies application deadline job type full time salary per year benefits cell phone reimbursement commuter assistance flexible schedule health insurance internet reimbursement paid sick time paid time work home schedule day shift supplemental pay performance bonus yearly bonus experience total work year required programming languages needed swift required work remotely temporarily due covid,Node js developer
449,job summary based company looking ios developer ahmedabad looking ios developer possesses passion pushing mobile technologies limits work team talented engineers design build next generation mobile applications responsibilities duties design develop test deploy mobile applications develop maintain efficient reusable robust extensible customizable mobile application code frameworks ensure best possible performance quality responsiveness applications gather requirements directly client make development plan forecast timeline completion responsible developing high quality product client developing iphone ipad applications using xcode objective storyboard swift required experience skills qualifications working knowledge general mobile landscape architectures trends emerging technologies experience ios frameworks core data core animation uikit framework etc strong oops data structures background good knowledge database concepts design proven experience full mobile application design development deployment lifecycle including debugging understanding design principles ios testing considerations familiarity connecting restful back end services cloud message api push notifications solid understanding software design patterns mvc mvvm etc must familiar itunes connect apple developer account services certificates provisional profiles testflight testing job type full time salary per month experience objective year preferred work year preferred ios year preferred education bachelor required industry software development,iOS Developer
453,excited big data machine learning predictive software interested creating new state art solutions using machine learning data mining techniques terabytes data amazon bangalore developing state art large scale machine learning services applications cloud involving terabytes data work applying predictive technology wide spectrum problems areas amazon retail seller services customer service alexa chatbots looking talented experienced machine learning scientists related area preferred apply innovative machine learning techniques real world commerce problems get work team dedicated advancing machine learning technology amazon converting business impacting solutions major responsibilities use machine learning data mining statistical techniques create new scalable solutions business problems analyze extract relevant information large amounts amazons historical business data help automate optimize key processes design develop evaluate highly innovative models predictive learning establish scalable efficient automated processes large scale data analyses model development model validation model implementation research implement novel machine learning statistical approaches basic qualifications basic qualifications masters phd machine learning operational research statistics highly quantitative field experience predictive modelling analysis predictive software development strong problem solving ability good skills java scala perl python similar scripting language experience using matlab statistical software strong communication data presentation skills preferred qualifications preferred qualifications experience handling gigabyte terabyte size datasets experience working distributed systems grid computing knowledge latest state art technology publications presentation recognized machine learning data mining journals conferences,Machine Learning
651,securonix securonix com market leader entity user behavior analytics offering risk mitigation incident response rapid detection sophisticated insider threats cyber attacks securonix helps clients across globe address cyber security needs including detection advanced persistent threats apts insider threats privilege account misuses enterprise online fraud security analytics platform used largest organizations financial healthcare pharmaceutical manufacturing federal sectors securonix looking dev ops engineer join content threat research analytics cta team content migration management along integrating new data science algorithms required work different cross functional teams including product engineering field engineers threat researchers data scientists role require automating content migration process integrating various big data technologies role responsibilities automation aspects committing new content work closely product management development teams oversee updates content automate responsible content packing maintaining versions around content updates changes ability translate automate changes content files xmls required understand business needs updates translate solution ensure practices sdlc including unit testing conducted build automated framework detect issues content packaging data transformation occasion required standardize unstructured data structured readable format qualifications years product development experience experience scripting language preferably python shell experience understanding code repositories like svn experience unix linux environments experience databases mysql experience automation servers jenkins collaborate effectively internal well cross functional teams self starter ability solve complex problems deliver innovative solutions experience working big data cloud services hadoop solr hbase kafka mandatory preferred bachelor degree required preferably computer science another related technical field good communication interpersonal skills securonix inc provides equal employment opportunities eeo employees applicants employment without regard race color religion gender sexual orientation gender identity national origin age disability genetic information marital status amnesty status covered veteran accordance applicable federal state local laws securonix complies applicable state local laws governing nondiscrimination employment every location company facilities policy applies terms conditions employment including hiring placement promotion termination layoff recall transfer leaves absence compensation training securonix expressly prohibits form unlawful employee harassment based race color religion gender sexual orientation national origin age genetic information disability veteran status improper interference ability securonix employees perform expected job duties absolutely tolerated,DevOps Engineer
1789,years experience mobile app development android ios must built production applications large data user base years experience flutter development least projects must completed must deep understanding dart able produce cross platform apps using flutter sdk based business requirements strong knowledge data structures algorithms object oriented programming experience agile environment strong knowledge android sdk kotlin swift ios sdk similar cross platform languages familiarity party libraries integration firebase experience cloud push notifications cloud functions analytics experience git familiarity restful apis contract length months job types full time contract salary per month schedule flexible shift morning shift experience flutter year preferred mobile app development years preferred location chennai tamil nadu preferred work remotely temporarily due covid,Flutter Developer
1424,expires november job code hyderabad experience years location hyderabad looking devops engineer responsibilities comfortable developing automation data platform process multi billion records data volumes daily different delivery teams distributed globe requirements years experience senior devops engineer proven track record creating highly automated solutions unlock faster delivery experience fully understands devops applied data analytics platforms preferably read fully understands devops handbook expert scripting languages phyton powershell expert azure devops pipelines repositories etc expert advance monitoring alerting platforms datadog stackstate understand complexities used navigate ambiguity large complex global organizations proven knowledge modern relational database technologies snowflake sql managed instance sql server hyperscale proven knowledge modern data ingestion technologies etl frameworks wherescape azure data factory talend comfortable developing automation data platform process multi billion records data volumes daily different delivery teams distributed globe,DevOps Engineer
465,looking enthusiastic passionate developer good understanding hands experience javascript primary skills must years experience developing web apps using object oriented javascript years experience developing hybrid mobile applications using javascript mvc frameworks angular backbone ember strong experience mobile frameworks jquery mobile ionic strong experience working html css knowledge ajax concepts communication protocols data services drive engaging front end experiences secondary skills good familiar vector graphics scripting libraries raphael paper familiar osx ios operating systems familiar server side javascript using node express experience background languages java etc basic working knowledge adobe photoshop years masters technology tech bachelor computer application master computer application bachelor technology tech,JavaScript Developer
1967,essential duties responsibilities developing complete website architecture creating websites website using standard html css practices designing user interactions web pages developing back end website applications creating servers databases functionality ensuring cross platform optimization mobile phones ensuring responsiveness applications seeing project conception finished product designing developing apis meeting technical consumer needs researching different software programs maintaining software documentation implementing contingency plans case website goes maintaining expanding enhancing website built job requirements minimum experience front end development tech mca years experience html css javascript jquery familiarity database technology mysql mongodb working knowledge php backend technologies solid understanding web applications work including security session management best development practices adequate knowledge relational database systems object oriented programming web application development basic knowledge search engine optimization process strong organizational skills juggle multiple tasks within constraints timelines budgets business acumen ability work thrive fast paced environment learn rapidly master diverse web technologies techniques job type full time salary per year schedule day shift experience total work years required javascript year preferred html css jquery years required work remotely temporarily due covid,Backend Developer
1019,job brief looking python developer join engineering team help develop maintain various software products python developer responsibilities include writing testing code debugging programs integrating applications third party web services successful role experience using server side logic work well team ultimately build highly responsive web applications align business needs responsibilities write effective scalable code develop back end components improve responsiveness overall performance integrate user facing elements applications test debug programs improve functionality existing systems implement security data protection solutions assess prioritize feature requests coordinate internal teams understand user requirements provide technical solutions requirements work experience python developer expertise least one popular python framework like django flask pyramid knowledge object relational mapping orm familiarity front end technologies like javascript html team spirit good problem solving skills qualification tech computer science mca bca year experience must sound knowledge html css python php java etc experience required years work home contract period months surat candidates preferred job type full time salary per month schedule day shift experience total work year required python year required education bachelor required work remotely speak employer,Django Developer
1579,immediate need devops engineer job title member technical staff job code job function engineering classification regular full time compensation tbd location hyderabad india mission devops team build operate data centers containing thousands servers across several continents members devops team support application development teams working directly using scrum methodologies team responsible building maintenance data centers monitoring services development platform integration management capacity planning release management application development support network support troubleshooting member devops team must able ask right questions understand business technical requirements internal external clients translate needs actionable items execution conjunction cross functional team members ensure operational integrity global infrastructure using well controlled processes build expand infrastructure capacity remote data centers perform deployments maintenance implement code architecture configuration changes provide support diagnose issues teams related infrastructure participate global call rotation develop maintain new health checks system application level monitoring skills competencies bsee bscs equivalent msee mscs plus strong linux experience years experience high volume environment excellent understanding datacenter operations experience managing least hundreds servers knowledge cloud services google cloud platform aws cloudfront configuration management puppet chef similar systems scripting bash perl python scripting languages experience build tools jenkins enjoy automating tasks rather repeating strong knowledge internet building blocks tcp dns http effective english written verbal communication skills ability adapt rapidly changing environment comfortable collaborating supporting diverse team engineers ability troubleshoot problems complex systems flexible working hours ability participate global call support remote team members familiarity monitoring alerting tools graphite nagios pingdom catchpoint pagerduty experience agile development methodologies plus self starter able complete defined tasks independently,DevOps Engineer
