,Job Description,Job Title
2193,honeywell fortune company global sales surpassing one fortunes admired companies decade innovation company brings together physical digital world tackle toughest societal business problems making world productive safe sustainable place business organized five primary groups aerospace buildings performance materials technologies safety productivity solutions connected enterprise honeywell specializes things critically connected beyond smart phones laptops make kinds connections keep cities working planes flying plants running workers safe unique capabilities century making bring together data expertise technology connect people processes assets honeywell charging industrial iot revolution establishment honeywell connected enterprise hce building heritage invention deep ground industry expertise hce leading industrial disruptor building connecting software solutions streamline centralize assets people processes help customers make smarter accurate business decisions moving speed software creating innovating delivering solutions fast challenging way things always done piloting new ways work expecting successes set new standards customers honeywell honeywell international building world thats safer secure comfortable energy efficient innovative productive information please visit honeywell com follow honeywellnow looking new team member motivated cracking tough challenges data trained problem solving unending thirst learning senior data scientist join high performing global team assist designing developing deploying data driven solutions honeywell business groups functions work closely application architects integrate results operational platforms including hadoop nosql architectures additionally senior data scientist role expected work within honeywell identify opportunities new growth efficiencies based data analyses adjacencies based previous engagements well larger industry developments specific responsibilities develop data modeling mining pattern analysis data visualization machine learning solutions address customer needs foster relationships business team members proactive displaying thorough understanding business processes recommending innovative solutions communicate project output terms customer value business objectives product opportunity promote data science methods processes across functions work businesses infrastructure teams develop strategy clearly outline enterprise platforms enable business growth productivity must masters degree computer science engineering applied mathematics related field minimum years data science prototyping experience physical systems minimum years experience distributed storage compute tools spark minimum year experience developing deploying natural language processing understanding applications value phd degree computer science engineering applied mathematics related field experience bringing prototypes production containerized micro services experience python experience streaming analytics experience recurrent neural network architectures experience image analytics experience sql experience tableau experience working remote global teams results driven positive attitude job posting exist global job code please work hrg develop one additional information job req category engineering location camp bldgs plot rmz ecoworld varturhobli sarjapur marathahalli outer ring road bangalore karnataka india exempt,Machine Learning
2200,nvidia network engineering looking network engineer join fast paced results oriented team challenges include balancing project responsibilities escalated operational issues primary skillset routing switching foundation ability define lead primarily engineering lab network refresh upgrades globally job might designs plans coordinates implementation network technologies support defined requirements generated business growth demands labs validate project requirements define project scope develop project schedules produce detailed designs assigned projects produce work breakdown structures demonstrate understanding proposed changes change executed minimal service impact performs analysis diagnosis highly complex networking problems builds simulated networks test labs resolve highly challenging problems compatibility issues prepare maintain date documentation detailing configuration deployed solutions generates network configurations plans executes highly complex network upgrade migration activity assists deployment strategy tools related network management systems provides mentor ship existing network team members appropriate need see equivalent plus years progressive experience network engineering support environment experience expertise network operations service optimization highly available network infrastructure solutions large scale multi site international environment design experience expert knowledge mellanox cumulus arista cisco datacenter switching technologies used large scale engineering labs data center deployments strong depth knowledge engineering lab network technologies expertise inter networking lan switching wireless technologies wan circuits protocols vpls mpls dwdm dmvpn optimization dynamic routing protocols ospf isis eigrp bgp pim multicast experience latest hardware operating systems cumulus arista eos crs nexus ios junos experience inter connectivity ebgp mpls high availability protocols global server load balancing technologies new generation firewalls stateful firewalls ssl vpn virtualization technologies networking vrf vdc nexuskv compute vmware openstack high level inter networking troubleshooting large scale network environment knowledge network management network availability capacity planning expertise interfacing carriers manage circuit delivery troubleshooting migration must exceptional verbal written interpersonal presentation skills must creative initiative ccie equivalent plus ways stand crowd self driven resourceful achieve goals independently well work well groups flexibility adjust changing requirements schedules priorities ability socialize ideas make recommendations gather team consensus move forward must able effectively communicate orally writing technical non technical audiences levels organization develop procedural documentation develop conduct effective presentations effectively demonstrate products solutions ability connect new technology initiatives cost savings roi calculations nvidia leading way groundbreaking developments artificial intelligence high performance computing visualization gpu invention serves visual cortex modern computers heart products services work opens new universes explore enables amazing creativity discovery powers science fiction inventions artificial intelligence autonomous cars nvidia looking exceptional people like help accelerate next wave artificial intelligence,Network Administrator
1090,job description atom cto looking full stack javascript developer join international team experienced developing web applications apis javascript using frameworks like express fastify feathers etc comfortable creating client applications vue nuxt react next integrate third party apis role mix work discover latest greatest trends well building solutions spec believe work balanced personal time find long hours asked sacrifice free time projects agree work week get roles responsibilities working part house development team build solutions translating designs requirements maintainable code follows best practices building pixel perfect uis building reusable components front end libraries future use optimizing components maximum performance across platforms willingness learn new platforms adapt requirements change coordinating teams team members integrate systems managing time reporting progress key skills commercial experience building javascript web applications apis commercial experience building javascript typescript web clients vue react etc experience working sql nosql data stores experience integrating consuming third party apis root cause analysis diagnostic examinations resolve issues practical experience design patterns strong grounding solid principles systems analysis design comfortable git github bitbucket unit testing test driven development result oriented attitude excellent verbal written communication skills english advantageous skills basic understanding gdpr data governance protection experience experience working cloud platform azure aws gcp additional development experience frameworks languages perks benefits work life balance hate working evenings weekends choose hours long work gets done mind gets done code night sleep day like variety work stream projects across different sectors tech fin tech blockchain educate learning important share passion rest team cross pollinate ideas international london team clients spread across world years bachelor technology tech masters technology tech,JavaScript Developer
1257,project coordinator san jose evergreen community college district position required document letter introduction cover letter resume copy transcript associate degree equivalent department facility bond program management posting date first review date position status full time salary range annual salary range classified salary schedule fiscal year starting placement generally step benefit available classified excellent fringe benefit package includes district paid medical dental vision eap employee assistance plan life insurance employee eligible dependent income protection voluntary plan include supplemental life insurance flexible spending account deferred compensation account classified employee also receive vacation sick leave paid holiday employment start date soon possible position summary program coordinator report director facility bond program district office work schedule month per year monday friday position represented california school employee association csea chapter position purpose direction director facility bond program management assigned administrator project coordinator performs wide range complex clerical standard advanced office support duty management bond capital outlay program position coordinate various communication activity among administrator department staff vendor consultant public duty responsibilities specific position perform appropriate administrative operation support duty assigned supervisor relieve variety technical administrative detail may provide support dept manager staff member coordinate liaison dept college administrator faculty staff architect engineer consultant coordinate activity group preparation project design drawing specification maintain accurate detailed calendar event due date schedule relate assigned area service ensure proper task activity occur scheduled prepare meeting agenda minute construction schedule update construction management consultant required project construction management bond executive meeting assist onsite coordination move construction project coordinate construction manager faculty staff purchasing personnel necessary assist preparation departmental report gathering organizing summarizing information variety source including submittals update california community college chancellor office fusion database track project budget activity assist resolving department budget issue problem coordinate timesheets monitor expenditure related bond project maintain organize facility department network physical information storage system ensure required document received logged district record update construction communication keeping information current community district needed support vendor outreach effort accordance board policy prepare compose formal correspondence various agency architect firm college department community required perform related duty assigned employment standard knowledge modern office method equipment including computer terminal micro computer usage word processing application facility project construction management software system record keeping principle procedure business accounting mathematics acceptable business office etiquette organization time management standard office procedure ability read interpret apply explain district policy procedure regulation utilize exceptional organizational skill dealing ambiguity change establish review work priority work independently follow task compile information write report business correspondence procedure manual using correct english grammar spelling punctuation vocabulary exhibit strong sense urgency regarding work progress project effectively communicate interact person diverse background ability establish maintain cooperative working relationship contacted course work minimum qualification education experience associate degree accredited institution preferably business construction management related field three year administrative support experience involving heavy public contact primary support individual department preferably public sector demonstrated sensitivity knowledge understanding diverse academic socioeconomic gender gender identity cultural disability ethnic background student serve sensitivity knowledge understanding group historically underrepresented group may experienced discrimination success integrating diversity appropriate major duty outlined job description duty listed district hiring policy demonstrated equivalent transferable skill working condition environment typical office environment physical demand requires sufficient hand eye arm coordination use keyboard plus arm hand movement retrieve work material operate variety general office equipment requires visual acuity read word number requires auditory ability carry conversation phone person san jose evergreen community college district classified district represented dedicated talented employee passionate providing student population best educational experience possible district recognizes cultural diversity academic environment promotes academic excellence foster cultural racial human understanding provides positive role model student creates inclusive supportive educational work environment employee student community serf fall enrollment approximately per semester extremely diverse student population hispanic latino black african american asian pacific islander american indian native american white caucasian attaining educational goal reflecting degree transfer year college university district emphasis student success make recognized educational leader state district encourages diverse pool applicant serve colleague existing diverse classified staff consisting hispanic latino asian pacific islander black african american american indian native american white caucasian well encouraging application qualified outstanding applicant full application instruction position description visit http www edjoin org home jobposting copyright jobelephant com inc right reserved posted free value added recruitment advertising agency jeid bebebcfebebbeea,Database Administrator
1791,slidesigma seeking experienced javascript developer motivated combine art design art java programming ideal candidate responsible implementing front end logic defines behavior visual elements web applications bridging gap visual elements server side infrastructure implementing javascript applications emphasis optimization api design architecture experience years roles responsibilities develop enhance main front end platforms creating new user facing features design develop new front end applications assist front end work applications html css ruby applications develop specifications designs complex applications modifying maintaining complex existing applications perform code analysis requirements analysis identification code metrics system risk analysis software reliability analysis performance tuning improvement balancing usability automation requirements years experience web technologies html css javascript expert knowledge javascript strong understanding javascript fundamentals prototype inheritance composition commonjs amd module systems using requirejs experience responsive design desktop mobile extensive html css ajax javascript jquery backbone angular ember coding experience css compiler knowledge sass less experience libraries like extjs backbone angular node frameworks,JavaScript Developer
1087,job position node developer experience yrs description experience html css ajax programming languages like programming python node mysql mongo puppet php kvm openstack aws open source python perl kafka development experience designing object oriented javascript node knowledge web libraries frameworks angularjs polymer closure javascript proficiency including syntax node database knowledge must mongodb mysql experience working mean stack thorough understanding node principles experience data structure libraries proficient source control management collaboration tools git diligence coding standards experience external integrations plus expertise linux based systems experience testing automation frameworks skills javascript nodejs mongodb mean mern angular typescript npm git qualification btech mca mcs job type full time location pune,Node js developer
666,telecommute location remote latin america growing start amazing opportunities nearsure created help based companies augment software development teams efficiently remote first connecting developers across latin america access top tech talent keeping lean organizational structure reach spans thousands professionals skills multiple industries technologies fully distributed team working remotely argentina bolivia colombia ecuador honduras mexico peru uruguay want keep expanding latin america role description looking full stack engineer python javascript expertise work home challenging project joining team distributed company automotive industry develop front end back end solutions digital automotive merchandising platform offers personalized physical showroom experience car shoppers successful candidate also collaborate communicate remotely team engineers qas scrum masters product owners deliver code strong focus quality using agile methodologies remote full time position hours workload per week latin america skills jquery python communication skills full stack development agile written communication skill time management responsibilities duties requirements years professional experience engineering role proficiency python knowledge javascript strong written verbal communication skills trustworthy goal oriented team player organizational time management skills able collaborate communicate efficiently distributed team desired qualifications familiarity flask understanding jquery experience working agile methodologies experience working remotely offer work home flexible working schedules competitive salary usd paid time annual leave national holidays sick time parental leave take part challenging projects distributed companies integrate growing team great opportunities professional growth friendly multicultural environment great company culture tailor made benefits package focused health wellbeing entertainment training personal finances available choose really care fully distributed multicultural start looking best talent latin america hesitate apply feel good fit position required experience qualifications experience years fullstack python javascript development required graduation degree preferred proficient english required,JavaScript Developer
1185,looking someone experienced passionate product development love code skilled software developer based bangalore ready move someone looking get involved product development involve analytical problem solving skill rather coding requirement key skills required dart flutter android api integration google cloud min years experience added advantages design development node html css job type full time salary per year benefits flexible schedule health insurance schedule day shift flexible shift supplemental pay performance bonus experience flutter year required total work year preferred javascript year preferred education bachelor preferred,Flutter Developer
1048,overview database administrator install upgrade administer maintain customize microsoft sql server mongodb database analysis transactional environment database administrator must familiar aspect database server microsoft based environment person work closely information system staff various department support implement variety application including corporate wide data warehouse environment internally developed application shelf software responsibility build configure maintain microsoft sql server mongodb server assist implementation internal database application assist implementation database backup security standard monitor optimize query database performance assist design data warehouse ensure system availability optimal performance query data warehouse general troubleshooting work closely various business user assist implementing database user assist implementing database application participate weekly call rotation including weekend support company database work various business user understand document data meaning perform duty responsibility specific department function activity perform duty responsibility required assigned supervisor requirement skill year microsoft sql server experience additional database engine technology oracle mongodb postgres hadoop strong plus knowledge indexing trigger stored procedure function knowledge data warehousing practice including dimensional modeling etl process specifically utilizing ssis informatica etl tool extensive knowledge sql server performance tuning technique strong transact sql experience good organization communication skill strong analytical thinking excellent troubleshooting ability manage multiple concurrent project experience third party etl tool ssis informatica sagent strong plus knowledge software service industry plus experience high availability technique technology sql mirroring replication clustering log shipping experience san technology experience olap reporting tool business object cognos ssa ssrs plus must posse excellent written oral communication skill ability clearly define project objective goal schedule assignment must posse ability work effectively business personnel level well outside vendor contractor proficiency varied type computer hardware software proficiency varied computer network operating system must exercise reasonable amount independent judgment minimum supervision requires strong interpersonal organizational skill including ability meet deadline team player provide extraordinary service company culture value mental physical requirement ability learn comprehend basic instruction understand meaning word respond effectively perform basic arithmetic accurately quickly vision must sufficient read data report manual computer screen hearing must sufficient understand conversation normal volume including telephone call person speech must coherent clearly convey exchange information including giving receiving assignment direction position involves sitting time may involve walking standing brief period time dice,Database Administrator
1125,looking application support engineer freshers also apply responsibilities support application stack hosted aws azure cloud environments premise party data centers provide rotational hours support needed call basis handle testing changes deployment dev stage production environment within slas identify new processes modify existing processes improve efficiencies support monitoring department application suite assume responsibility bug fix small change requests specified applications additional development activities anticipated whilst development opportunities anticipated team established development role ensure team follow company standards industry best practice approaches development activities continuously evaluates design functionality performance supported applications makes thoughtful significant recommendations improvements ensure transition support documentation fit purpose high standard kept date perform duties required requirements bachelor degree computer engineering computer science equivalent years experience application support environment practical experience transitioning apps production support environment excellent communication skills verbal written organizational prioritization skills must knowledge knowledge experience supporting large scale client facing applications online platforms knowledge web windows based technologies iis windows server mvc architecture entity frameworks advantage knowledge net development toolsets asp net net web api associated development toolsets net development studio visual studio experience html css scripting languages angularjs javascript jquery experience sql server rdbms writing stored procedures functions ssis optimization queries etc experience source control release management tool sets tfs adherence sdlc standards development using agile scrum methodologies testing best practice sdlc documentation creating support development standards associated documentation cloud computing practices aws azure terminology technology concepts knowledge itil itsm best practices service transition incident change problem management itsm toolsets knowledge itsm bug management platforms servicenow jira python advantage familiarity docker kubernetes preferred advantage whatsapp team,Network Administrator
